{
  "$defs": {
    "Evidence": {
      "additionalProperties": false,
      "description": "Where a fact was found. ``line`` is None when the fact is about the whole file.",
      "properties": {
        "file": {
          "title": "File",
          "type": "string"
        },
        "line": {
          "anyOf": [
            {
              "type": "integer"
            },
            {
              "type": "null"
            }
          ],
          "default": null,
          "title": "Line"
        },
        "snippet": {
          "anyOf": [
            {
              "type": "string"
            },
            {
              "type": "null"
            }
          ],
          "default": null,
          "title": "Snippet"
        }
      },
      "required": [
        "file"
      ],
      "title": "Evidence",
      "type": "object"
    }
  },
  "$id": "legacy-audit/facts/entry_point.schema.json",
  "$schema": "https://json-schema.org/draft/2020-12/schema",
  "additionalProperties": false,
  "properties": {
    "component": {
      "anyOf": [
        {
          "type": "string"
        },
        {
          "type": "null"
        }
      ],
      "default": null,
      "title": "Component"
    },
    "evidence": {
      "items": {
        "$ref": "#/$defs/Evidence"
      },
      "title": "Evidence",
      "type": "array"
    },
    "file": {
      "title": "File",
      "type": "string"
    },
    "id": {
      "title": "Id",
      "type": "string"
    },
    "kind": {
      "description": "main, scheduler, filter, listener, spring-boot-app, desktop-app, windows-service, ...",
      "title": "Kind",
      "type": "string"
    },
    "line": {
      "anyOf": [
        {
          "type": "integer"
        },
        {
          "type": "null"
        }
      ],
      "default": null,
      "title": "Line"
    },
    "name": {
      "title": "Name",
      "type": "string"
    }
  },
  "required": [
    "id",
    "name",
    "kind",
    "file"
  ],
  "title": "EntryPoint",
  "type": "object"
}
